{
  "$schema": "https://json-schema.org/draft/2020-12/schema",
  "title": "SkillRequestSpec",
  "type": "object",
  "required": [
    "type",
    "skill_id",
    "request_id",
    "inputs"
  ],
  "properties": {
    "type": {
      "const": "skill_request_spec"
    },
    "request_id": {
      "type": "string"
    },
    "skill_id": {
      "type": "string"
    },
    "inputs": {
      "type": "object"
    },
    "options": {
      "type": "object"
    },
    "evidence_root": {
      "type": "string"
    },
    "notes": {
      "type": "string"
    }
  },
  "additionalProperties": false
}